{
  "$schema": "http://json-schema.org/draft-07/schema#",
  "$id": "https://pliego.dev/schema/input-manifest.v1.json",
  "title": "Pliego API 2 InputManifest",
  "description": "The canonical path-independent byte closure supplied to the deterministic renderer.",
  "type": "object",
  "additionalProperties": false,
  "required": ["schema", "version", "url_root", "entries"],
  "properties": {
    "schema": { "const": "pliego.input-manifest" },
    "version": { "const": 1 },
    "url_root": { "const": "pliego-input:///" },
    "entries": {
      "type": "array",
      "minItems": 1,
      "maxItems": 16384,
      "description": "Canonical files; files plus distinct implied directories total at most 16384 nodes.",
      "items": { "$ref": "#/definitions/entry" }
    }
  },
  "definitions": {
    "content_address": {
      "type": "string",
      "pattern": "^sha256:[0-9a-f]{64}$"
    },
    "portable_path": {
      "type": "string",
      "minLength": 1,
      "maxLength": 240,
      "description": "A portable relative path with at most 32 segments.",
      "pattern": "^[A-Za-z0-9](?:[A-Za-z0-9._/-]*[A-Za-z0-9_-])?$"
    },
    "media_type": {
      "type": "string",
      "minLength": 3,
      "maxLength": 255,
      "pattern": "^[a-z0-9][a-z0-9!#$&^_.+-]*/[a-z0-9][a-z0-9!#$&^_.+-]*(?:;charset=utf-8)?$"
    },
    "entry": {
      "type": "object",
      "additionalProperties": false,
      "required": ["path", "media_type", "sha256", "bytes"],
      "properties": {
        "path": { "$ref": "#/definitions/portable_path" },
        "media_type": { "$ref": "#/definitions/media_type" },
        "sha256": { "$ref": "#/definitions/content_address" },
        "bytes": { "type": "integer", "minimum": 0, "maximum": 67108864 }
      }
    }
  }
}
