{"schema":"pliego.input-manifest","version":1,"url_root":"pliego-input:///","entries":[{"path":"assets/fixture-font.bin","media_type":"application/octet-stream","sha256":"sha256:bf0cf8c8fff21d37f18617edb5677ed60cd2ea9dae07bfc8571d9f11da706a00","bytes":38},{"path":"assets/mark.svg","media_type":"image/svg+xml","sha256":"sha256:83ee8b728ac4d73ac6454bd63f58ef28f97d40d38ad6ddfd499e3f890b4a8ca4","bytes":107},{"path":"document.html","media_type":"text/html;charset=utf-8","sha256":"sha256:a519abf942fe2760c32c971b0dbb2a6574e02d2f8fc320b43dc124d99b856ec7","bytes":298},{"path":"styles.css","media_type":"text/css;charset=utf-8","sha256":"sha256:e2d2027373fa2b9d769f9070088af27e3312b3d13a221f1b78035481fb1a8f68","bytes":251}]}
